{
  "$schema": "https://json-schema.org/draft/2020-12/schema",
  "$id": "https://schemas.riverside.example/contracts/v1/app-chat-completion-stream-event.schema.json",
  "title": "Riverside OpenAI-Compatible Chat Completion Stream Event v1",
  "type": "object",
  "additionalProperties": false,
  "required": [
    "id",
    "object",
    "created",
    "model",
    "choices",
    "trace",
    "deployment"
  ],
  "properties": {
    "id": {
      "type": "string",
      "pattern": "^chatcmpl-[A-Za-z0-9_-]{8,64}$"
    },
    "object": {
      "const": "chat.completion.chunk"
    },
    "created": {
      "type": "integer",
      "minimum": 0
    },
    "model": {
      "type": "string",
      "minLength": 1,
      "maxLength": 128,
      "pattern": "^[a-z0-9][a-z0-9._-]*$"
    },
    "choices": {
      "type": "array",
      "minItems": 1,
      "maxItems": 1,
      "items": {
        "type": "object",
        "additionalProperties": false,
        "required": [
          "index",
          "delta",
          "finish_reason"
        ],
        "properties": {
          "index": {
            "const": 0
          },
          "delta": {
            "type": "object",
            "additionalProperties": false,
            "properties": {
              "role": {
                "const": "assistant"
              },
              "content": {
                "type": "string",
                "maxLength": 32768
              }
            }
          },
          "finish_reason": {
            "type": [
              "string",
              "null"
            ],
            "enum": [
              "stop",
              "length",
              "content_filter",
              "error",
              null
            ]
          }
        }
      }
    },
    "usage": {
      "type": "object",
      "additionalProperties": false,
      "required": [
        "prompt_tokens",
        "completion_tokens",
        "total_tokens"
      ],
      "properties": {
        "prompt_tokens": {
          "type": "integer",
          "minimum": 0,
          "maximum": 8192
        },
        "completion_tokens": {
          "type": "integer",
          "minimum": 0,
          "maximum": 2048
        },
        "total_tokens": {
          "type": "integer",
          "minimum": 0,
          "maximum": 10240
        }
      }
    },
    "citations": {
      "type": "array",
      "maxItems": 20,
      "items": {
        "$ref": "citation.schema.json"
      }
    },
    "trace": {
      "$ref": "common.schema.json#/$defs/traceMetadata"
    },
    "deployment": {
      "$ref": "deployment-metadata.schema.json"
    }
  }
}
