{
  "id": "chatcmpl-riverside0001",
  "object": "chat.completion.chunk",
  "created": 1785931260,
  "model": "riverside-editor",
  "choices": [
    {
      "index": 0,
      "delta": {
        "role": "assistant",
        "content": "Aria sees"
      },
      "finish_reason": null
    }
  ],
  "trace": {
    "trace_id": "0123456789abcdef0123456789abcdef",
    "retry_count": 0
  },
  "deployment": {
    "contract_version": "1.0.0",
    "kind": "deployment_metadata",
    "environment": "staging",
    "release_id": "riverside-editor-2026-08-05",
    "model_alias": "riverside-editor",
    "deployment_name": "riverside-staging-green",
    "deployment_slot": "green",
    "region": "eastus2",
    "runtime": "azureml-riverside-runtime",
    "runtime_version": "1.0.0",
    "index_version": "1.0.0",
    "deployed_at": "2026-08-05T12:00:00Z",
    "source_commit": "0123456789abcdef0123456789abcdef01234567"
  }
}
